{
  "$schema": "../../schema/benefit.schema.json",
  "schemaVersion": 2,
  "accessChannelId": "aliyun-bailian-managed-agent",
  "id": "web-fetch-limited-free",
  "evidenceStatus": "supported",
  "sourceReferences": [
    "https://help.aliyun.com/zh/model-studio/managed-agents-builtin-tools",
    "https://help.aliyun.com/zh/model-studio/managed-agents-changelog"
  ],
  "eligibilityConditions": [
    {
      "kind": "one_of",
      "field": "tool",
      "values": ["web_fetch"]
    }
  ],
  "timeTrigger": {
    "kind": "tool_call"
  },
  "timeCondition": {
    "kind": "unresolved"
  },
  "effect": {
    "kind": "multiplier",
    "target": "price",
    "unit": "web_fetch 调用费用",
    "value": "0"
  }
}
