{
  "$schema": "../../schema/benefit.schema.json",
  "schemaVersion": 2,
  "accessChannelId": "google-gemini-developer-api",
  "id": "flash-2026-promotional-cache-storage-rate",
  "evidenceStatus": "supported",
  "sourceReferences": [
    "https://ai.google.dev/gemini-api/docs/pricing"
  ],
  "eligibilityConditions": [
    {
      "kind": "one_of",
      "field": "model",
      "values": [
        "gemini-3.6-flash",
        "gemini-3.7-flash",
        "gemini-3.8-flash"
      ]
    },
    {
      "kind": "one_of",
      "field": "billing_mode",
      "values": [
        "Paid Standard",
        "Paid Batch",
        "Paid Flex",
        "Paid Priority"
      ]
    },
    {
      "kind": "one_of",
      "field": "meter",
      "values": [
        "Context cache storage price"
      ]
    }
  ],
  "timeTrigger": {
    "kind": "metered_usage"
  },
  "timeCondition": {
    "kind": "unresolved",
    "knownBoundaries": [
      {
        "role": "end",
        "date": "2026-12-31",
        "timeZone": null
      }
    ]
  },
  "effect": {
    "kind": "unit_rate",
    "entries": [
      {
        "meter": "Context cache storage price",
        "measure": {
          "kind": "money",
          "currency": "USD"
        },
        "per": "1M tokens·hour",
        "regular": "1.00",
        "benefit": "0.50"
      }
    ]
  }
}
