{
  "$schema": "../../schema/benefit.schema.json",
  "schemaVersion": 2,
  "evidenceStatus": "supported",
  "accessChannelId": "volcengine-ark-agent-plan-personal",
  "id": "small-invited-first-subscription-2026-discount",
  "sourceReferences": [
    "https://docs.volcengine.com/docs/ark/agent-plan-personal-small-medium-invitation?lang=zh"
  ],
  "eligibilityConditions": [
    {
      "kind": "one_of",
      "field": "plan_tier",
      "values": [
        "Small"
      ]
    }
  ],
  "timeTrigger": {
    "kind": "subscription_order"
  },
  "timeCondition": {
    "kind": "unresolved",
    "knownBoundaries": [
      {
        "role": "start",
        "date": "2026-07-24",
        "timeZone": null
      },
      {
        "role": "end",
        "date": "2026-12-31",
        "timeZone": null
      }
    ]
  },
  "effect": {
    "kind": "multiplier",
    "target": "price",
    "unit": "订单应付金额",
    "value": "0.95"
  }
}
