{
  "$schema": "../../schema/benefit.schema.json",
  "schemaVersion": 2,
  "accessChannelId": "minimax-token-plan-international",
  "id": "plus-annual-promotional-price",
  "evidenceStatus": "supported",
  "sourceReferences": [
    "https://platform.minimax.io/subscribe/token-plan",
    "https://platform.minimax.io/protocol/paid-agreement"
  ],
  "eligibilityConditions": [
    { "kind": "one_of", "field": "plan_tier", "values": ["Plus"] },
    { "kind": "one_of", "field": "billing_mode", "values": ["annual"] }
  ],
  "timeTrigger": { "kind": "subscription_order" },
  "timeCondition": { "kind": "unresolved" },
  "effect": {
    "kind": "unit_rate",
    "entries": [
      {
        "meter": "Plus annual subscription",
        "measure": { "kind": "money", "currency": "USD" },
        "per": "year",
        "regular": "240",
        "benefit": "200"
      }
    ]
  }
}
