{
  "$schema": "../../schema/benefit.schema.json",
  "schemaVersion": 2,
  "accessChannelId": "volcengine-ark-agent-plan-personal",
  "id": "medium-first-two-months-2026-upgrade-discount",
  "evidenceStatus": "supported",
  "sourceReferences": [
    "https://docs.volcengine.com/docs/ark/agent-plan-personal-universal-promotion?lang=zh",
    "https://www.volcengine.com/activity/agentplan"
  ],
  "eligibilityConditions": [
    {
      "kind": "one_of",
      "field": "plan_tier",
      "values": [
        "Medium"
      ]
    },
    {
      "kind": "one_of",
      "field": "billing_mode",
      "values": [
        "升配"
      ]
    }
  ],
  "timeTrigger": {
    "kind": "subscription_order"
  },
  "timeCondition": {
    "kind": "unresolved",
    "knownBoundaries": [
      {
        "role": "start",
        "date": "2026-06-08",
        "timeZone": null
      },
      {
        "role": "end",
        "date": "2026-11-08",
        "timeZone": null
      }
    ]
  },
  "effect": {
    "kind": "unresolved"
  }
}
