{
  "$schema": "../../schema/benefit.schema.json",
  "schemaVersion": 2,
  "accessChannelId": "tencent-token-plan-personal",
  "id": "hy4-preview-2026-september-october-half-price",
  "evidenceStatus": "supported",
  "sourceReferences": [
    "https://cloud.tencent.com/document/product/1823/133811",
    "https://cloud.tencent.com/document/product/1823/130060"
  ],
  "eligibilityConditions": [
    { "kind": "one_of", "field": "account_type", "values": ["个人用户"] },
    {
      "kind": "one_of",
      "field": "billing_mode",
      "values": ["通用 Token Plan", "Hy Token Plan"]
    },
    {
      "kind": "one_of",
      "field": "plan_tier",
      "values": ["Lite", "Standard", "Pro", "Max"]
    },
    { "kind": "one_of", "field": "model", "values": ["hy4-preview"] }
  ],
  "timeTrigger": { "kind": "model_request" },
  "timeCondition": {
    "kind": "absolute",
    "startsAt": "2026-09-25T00:00:00+08:00",
    "endsAt": "2026-10-08T12:00:00+08:00",
    "endInclusive": null,
    "endPrecision": "second"
  },
  "effect": {
    "kind": "unit_rate",
    "entries": [
      {
        "meter": "未命中缓存输入",
        "measure": { "kind": "credits", "unit": "积分" },
        "per": "1M tokens",
        "regular": "120",
        "benefit": "60"
      },
      {
        "meter": "输出",
        "measure": { "kind": "credits", "unit": "积分" },
        "per": "1M tokens",
        "regular": "360",
        "benefit": "180"
      },
      {
        "meter": "缓存命中输入",
        "measure": { "kind": "credits", "unit": "积分" },
        "per": "1M tokens",
        "regular": "6",
        "benefit": "3"
      }
    ]
  }
}
