{
  "$schema": "../../schema/benefit.schema.json",
  "schemaVersion": 2,
  "accessChannelId": "baidu-qianfan-token-benefit-pack",
  "id": "national-day-2026-expert-pack",
  "evidenceStatus": "supported",
  "sourceReferences": [
    "https://cloud.baidu.com/product/qianfan_home/campaign.html?track=home_banner"
  ],
  "eligibilityConditions": [
    {
      "kind": "one_of",
      "field": "plan_tier",
      "values": [
        "专家版"
      ]
    }
  ],
  "timeTrigger": {
    "kind": "subscription_order"
  },
  "timeCondition": {
    "kind": "unresolved",
    "knownBoundaries": [
      {
        "role": "start",
        "date": "2026-09-24",
        "timeZone": null
      },
      {
        "role": "end",
        "date": "2026-10-07",
        "timeZone": null
      }
    ]
  },
  "effect": {
    "kind": "unit_rate",
    "entries": [
      {
        "meter": "Token 福利包订单价格",
        "measure": {
          "kind": "money",
          "currency": "CNY"
        },
        "per": "订单",
        "regular": "400",
        "benefit": "240"
      },
      {
        "meter": "Token 福利包积分额度",
        "measure": {
          "kind": "quota",
          "unit": "积分"
        },
        "per": "订单",
        "benefit": "400000"
      }
    ]
  }
}
