{
  "$schema": "../../schema/benefit.schema.json",
  "schemaVersion": 2,
  "accessChannelId": "baidu-qianfan-token-plan-enterprise",
  "id": "night-model-credits-eighty-percent-off",
  "evidenceStatus": "supported",
  "sourceReferences": [
    "https://cloud.baidu.com/doc/qianfan/s/ymq8wwch2",
    "https://cloud.baidu.com/product/qianfan_home/token_plan.html"
  ],
  "eligibilityConditions": [
    {
      "kind": "one_of",
      "field": "model",
      "values": ["DeepSeek-V4-Pro", "GLM-5.2", "DeepSeek-V4-Flash-0731"]
    }
  ],
  "timeTrigger": {
    "kind": "model_request"
  },
  "timeCondition": {
    "kind": "unresolved"
  },
  "effect": {
    "kind": "multiplier",
    "target": "credits",
    "unit": "积分",
    "value": "0.2"
  }
}
