{
  "$schema": "../../schema/benefit.schema.json",
  "schemaVersion": 2,
  "accessChannelId": "aliyun-bailian-token-plan-team",
  "id": "standard-seat-prorated-limited-price",
  "evidenceStatus": "supported",
  "sourceReferences": [
    "https://help.aliyun.com/zh/model-studio/token-plan-team-overview",
    "https://help.aliyun.com/en/model-studio/token-plan-team-overview"
  ],
  "eligibilityConditions": [
    { "kind": "one_of", "field": "plan_tier", "values": ["标准坐席"] },
    { "kind": "one_of", "field": "region", "values": ["华北2（北京）"] },
    {
      "kind": "one_of",
      "field": "billing_mode",
      "values": ["加购坐席", "升级坐席"]
    }
  ],
  "timeTrigger": { "kind": "subscription_order" },
  "timeCondition": { "kind": "unresolved" },
  "effect": { "kind": "unresolved" }
}
