{
  "$schema": "../../schema/benefit.schema.json",
  "schemaVersion": 2,
  "accessChannelId": "aliyun-bailian-token-plan-personal",
  "id": "lite-limited-monthly-price",
  "evidenceStatus": "supported",
  "sourceReferences": [
    "https://help.aliyun.com/zh/model-studio/token-plan-personal-overview",
    "https://help.aliyun.com/en/model-studio/token-plan-personal-overview"
  ],
  "eligibilityConditions": [
    {
      "kind": "one_of",
      "field": "plan_tier",
      "values": [
        "Lite"
      ]
    },
    {
      "kind": "one_of",
      "field": "region",
      "values": [
        "华北2（北京）"
      ]
    },
    {
      "kind": "none_of",
      "field": "billing_mode",
      "values": [
        "升级"
      ]
    }
  ],
  "timeTrigger": {
    "kind": "subscription_order"
  },
  "timeCondition": {
    "kind": "unresolved"
  },
  "effect": {
    "kind": "unit_rate",
    "entries": [
      {
        "meter": "套餐订阅",
        "measure": {
          "kind": "money",
          "currency": "CNY"
        },
        "per": "月",
        "regular": "60",
        "benefit": "39"
      }
    ]
  }
}
