{
  "$schema": "../../schema/benefit.schema.json",
  "schemaVersion": 2,
  "evidenceStatus": "supported",
  "accessChannelId": "volcengine-ark-agent-plan-personal",
  "id": "continuous-annual-2026-2028-discount",
  "sourceReferences": [
    "https://docs.volcengine.com/docs/ark/agent-plan-personal-annual-quarterly?lang=zh"
  ],
  "eligibilityConditions": [
    {
      "kind": "one_of",
      "field": "plan_tier",
      "values": [
        "Small"
      ]
    },
    {
      "kind": "one_of",
      "field": "billing_mode",
      "values": [
        "连续包年开通"
      ]
    }
  ],
  "timeTrigger": {
    "kind": "subscription_order"
  },
  "timeCondition": {
    "kind": "unresolved",
    "knownBoundaries": [
      {
        "role": "start",
        "date": "2026-05-19",
        "timeZone": null
      },
      {
        "role": "end",
        "date": "2028-05-19",
        "timeZone": null
      }
    ]
  },
  "effect": {
    "kind": "unit_rate",
    "entries": [
      {
        "meter": "Agent Plan 套餐订阅",
        "measure": {
          "kind": "money",
          "currency": "CNY"
        },
        "per": "年",
        "regular": "480",
        "benefit": "456"
      }
    ]
  }
}
