{
  "$schema": "../../schema/benefit.schema.json",
  "schemaVersion": 2,
  "accessChannelId": "volcengine-ark-agent-plan-personal",
  "id": "deepseek-v4-1-flash-2026-model-discount",
  "evidenceStatus": "supported",
  "sourceReferences": [
    "https://docs.volcengine.com/docs/ark/coding-plan-personal-model-discount?lang=zh",
    "https://www.volcengine.com/activity/agentplan",
    "https://docs.volcengine.com/docs/ark/agent-plan-personal-afp-credits-billing-rules?lang=zh"
  ],
  "eligibilityConditions": [
    {
      "kind": "one_of",
      "field": "model",
      "values": ["deepseek-v4.1-flash"]
    }
  ],
  "timeTrigger": {
    "kind": "model_request"
  },
  "timeCondition": {
    "kind": "unresolved",
    "knownBoundaries": [
      {
        "role": "start",
        "date": "2026-09-15",
        "timeZone": null
      },
      {
        "role": "end",
        "date": "2026-10-30",
        "timeZone": null
      }
    ]
  },
  "effect": {
    "kind": "unit_rate",
    "entries": [
      {
        "meter": "输入",
        "measure": {
          "kind": "credits",
          "unit": "AFP"
        },
        "per": "10,000 tokens",
        "regular": "2.5",
        "benefit": "1.25"
      },
      {
        "meter": "输出",
        "measure": {
          "kind": "credits",
          "unit": "AFP"
        },
        "per": "10,000 tokens",
        "regular": "2.5",
        "benefit": "1.25"
      }
    ]
  }
}
