{
  "$schema": "../../schema/benefit.schema.json",
  "schemaVersion": 2,
  "accessChannelId": "aliyun-bailian-token-plan-team",
  "id": "standard-seat-limited-price",
  "evidenceStatus": "supported",
  "sourceReferences": [
    "https://help.aliyun.com/zh/model-studio/token-plan-team-overview",
    "https://help.aliyun.com/en/model-studio/token-plan-team-overview"
  ],
  "eligibilityConditions": [
    { "kind": "one_of", "field": "plan_tier", "values": ["标准坐席"] },
    { "kind": "one_of", "field": "region", "values": ["华北2（北京）"] },
    {
      "kind": "one_of",
      "field": "billing_mode",
      "values": ["新购", "续费", "自动续费"]
    }
  ],
  "timeTrigger": { "kind": "subscription_order" },
  "timeCondition": { "kind": "unresolved" },
  "effect": {
    "kind": "unit_rate",
    "entries": [
      {
        "meter": "标准坐席套餐订阅",
        "measure": { "kind": "money", "currency": "CNY" },
        "per": "坐席·月",
        "regular": "198",
        "benefit": "150"
      }
    ]
  }
}
